timestamp,status,message
2025-02-17T14:29:03.234122+00:00,in-progress,This project is in progress right now
2025-02-17T15:30:00.052035+00:00,on-hold,We decided to rethink this a bit.
2025-02-17T15:31:29.130501+00:00,on-hold,We decided to rethink this a bit.
2025-02-17T16:17:49.270592+00:00,on-hold,This is a new one.
2025-02-17T16:18:02.213925+00:00,in-progress,
2025-02-17T16:18:35.559946+00:00,completed,"We're done!

Can we make this multiple lines?"
2025-02-17T16:26:00.515172+00:00,in-progress,
2025-02-17T16:27:13.403549+00:00,on-hold,We can't do this right now.
